{"fenetre": {"debut": "2026-10-17T12:00:00.000000Z", "duree_s": 10.0, "pas_s": 5.0}, "origine": "labo", "scenario": "real-syn-flood", "noeuds": [{"id": "boutique/adservice", "role": "interne", "type": "service", "features": {"paquets_s": null, "octets_s": 5459.802667641148, "requetes_s": 0.0, "nb_flux": 0, "connexions_ouvertes": null, "ratio_syn": 0.0, "duree_moy_connexion": null, "nb_sources_uniques": 0, "nb_destinations": 1, "nb_ports": 1, "entropie_url": null, "entropie_ua": null, "variabilite_intervalles": null, "taille_moy_paquets": null, "cpu": 0.021668703384639044, "memoire": 0.3195442708333333, "latence_p95": null, "taux_erreurs": 0.0, "nb_alertes": 0, "gravite_max_alerte": 0, "instant_premiere_anomalie": 10.0}}, {"id": "boutique/shippingservice", "role": "interne", "type": "service", "features": {"paquets_s": null, "octets_s": 2565.6859504132235, "requetes_s": 0.0, "nb_flux": 0, "connexions_ouvertes": null, "ratio_syn": 0.0, "duree_moy_connexion": null, "nb_sources_uniques": 0, "nb_destinations": 1, "nb_ports": 1, "entropie_url": null, "entropie_ua": null, "variabilite_intervalles": null, "taille_moy_paquets": null, "cpu": 0.013739673680749657, "memoire": 0.064666748046875, "latence_p95": null, "taux_erreurs": 0.0, "nb_alertes": 0, "gravite_max_alerte": 0, "instant_premiere_anomalie": 10.0}}, {"id": "boutique/checkoutservice", "role": "interne", "type": "service", "features": {"paquets_s": null, "octets_s": 426.709231178505, "requetes_s": 0.0, "nb_flux": 0, "connexions_ouvertes": null, "ratio_syn": 0.0, "duree_moy_connexion": null, "nb_sources_uniques": 0, "nb_destinations": 1, "nb_ports": 1, "entropie_url": null, "entropie_ua": null, "variabilite_intervalles": null, "taille_moy_paquets": null, "cpu": 0.0007468040864594776, "memoire": 0.055633544921875, "latence_p95": null, "taux_erreurs": 0.0, "nb_alertes": 0, "gravite_max_alerte": 0, "instant_premiere_anomalie": 10.0}}, {"id": "boutique/productcatalogservice", "role": "interne", "type": "service", "features": {"paquets_s": null, "octets_s": 51637.46198734282, "requetes_s": 0.0, "nb_flux": 0, "connexions_ouvertes": null, "ratio_syn": 0.0, "duree_moy_connexion": null, "nb_sources_uniques": 0, "nb_destinations": 1, "nb_ports": 1, "entropie_url": null, "entropie_ua": null, "variabilite_intervalles": null, "taille_moy_paquets": null, "cpu": 0.09464962740774352, "memoire": 0.07940673828125, "latence_p95": null, "taux_erreurs": 0.0, "nb_alertes": 0, "gravite_max_alerte": 0, "instant_premiere_anomalie": 10.0}}, {"id": "boutique/paymentservice", "role": "interne", "type": "service", "features": {"paquets_s": null, "octets_s": 469.15760869565213, "requetes_s": 0.0, "nb_flux": 0, "connexions_ouvertes": null, "ratio_syn": 0.0, "duree_moy_connexion": null, "nb_sources_uniques": 0, "nb_destinations": 1, "nb_ports": 1, "entropie_url": null, "entropie_ua": null, "variabilite_intervalles": null, "taille_moy_paquets": null, "cpu": 0.0020787498877009552, "memoire": 0.208770751953125, "latence_p95": null, "taux_erreurs": 0.0, "nb_alertes": 0, "gravite_max_alerte": 0, "instant_premiere_anomalie": 10.0}}, {"id": "boutique/frontend", "role": "interne", "type": "gateway", "features": {"paquets_s": null, "octets_s": 471883.8683788121, "requetes_s": 0.0, "nb_flux": 0, "connexions_ouvertes": null, "ratio_syn": 0.0, "duree_moy_connexion": null, "nb_sources_uniques": 0, "nb_destinations": 1, "nb_ports": 1, "entropie_url": null, "entropie_ua": null, "variabilite_intervalles": null, "taille_moy_paquets": null, "cpu": 0.5164314806154293, "memoire": 0.124267578125, "latence_p95": null, "taux_erreurs": 0.0, "nb_alertes": 0, "gravite_max_alerte": 0, "instant_premiere_anomalie": 10.0}}, {"id": "boutique/redis-cart", "role": "interne", "type": "cache", "features": {"paquets_s": null, "octets_s": 4057.989778534923, "requetes_s": 0.0, "nb_flux": 0, "connexions_ouvertes": null, "ratio_syn": 0.0, "duree_moy_connexion": null, "nb_sources_uniques": 0, "nb_destinations": 1, "nb_ports": 1, "entropie_url": null, "entropie_ua": null, "variabilite_intervalles": null, "taille_moy_paquets": null, "cpu": 0.021777312624679652, "memoire": 0.098297119140625, "latence_p95": null, "taux_erreurs": 0.0, "nb_alertes": 0, "gravite_max_alerte": 0, "instant_premiere_anomalie": 10.0}}, {"id": "boutique/recommendationservice", "role": "interne", "type": "service", "features": {"paquets_s": null, "octets_s": 25575.553967119373, "requetes_s": 0.0, "nb_flux": 0, "connexions_ouvertes": null, "ratio_syn": 0.0, "duree_moy_connexion": null, "nb_sources_uniques": 0, "nb_destinations": 1, "nb_ports": 1, "entropie_url": null, "entropie_ua": null, "variabilite_intervalles": null, "taille_moy_paquets": null, "cpu": 0.0944295588975233, "memoire": 0.09029513888888889, "latence_p95": null, "taux_erreurs": 0.0, "nb_alertes": 0, "gravite_max_alerte": 0, "instant_premiere_anomalie": 10.0}}, {"id": "boutique/cartservice", "role": "interne", "type": "service", "features": {"paquets_s": null, "octets_s": 12410.579345088161, "requetes_s": 0.0, "nb_flux": 0, "connexions_ouvertes": null, "ratio_syn": 0.0, "duree_moy_connexion": null, "nb_sources_uniques": 0, "nb_destinations": 1, "nb_ports": 1, "entropie_url": null, "entropie_ua": null, "variabilite_intervalles": null, "taille_moy_paquets": null, "cpu": 0.048838396932791815, "memoire": 0.482147216796875, "latence_p95": null, "taux_erreurs": 0.0, "nb_alertes": 0, "gravite_max_alerte": 0, "instant_premiere_anomalie": 10.0}}, {"id": "boutique/currencyservice", "role": "interne", "type": "service", "features": {"paquets_s": null, "octets_s": 25141.366223908917, "requetes_s": 0.0, "nb_flux": 0, "connexions_ouvertes": null, "ratio_syn": 0.0, "duree_moy_connexion": null, "nb_sources_uniques": 0, "nb_destinations": 1, "nb_ports": 1, "entropie_url": null, "entropie_ua": null, "variabilite_intervalles": null, "taille_moy_paquets": null, "cpu": 0.15071771157098235, "memoire": 0.33203125, "latence_p95": null, "taux_erreurs": 0.0, "nb_alertes": 0, "gravite_max_alerte": 0, "instant_premiere_anomalie": 10.0}}, {"id": "boutique/emailservice", "role": "interne", "type": "service", "features": {"paquets_s": null, "octets_s": 723.5735186539868, "requetes_s": 0.0, "nb_flux": 0, "connexions_ouvertes": null, "ratio_syn": 0.0, "duree_moy_connexion": null, "nb_sources_uniques": 0, "nb_destinations": 1, "nb_ports": 1, "entropie_url": null, "entropie_ua": null, "variabilite_intervalles": null, "taille_moy_paquets": null, "cpu": 0.005201412330401251, "memoire": 0.32012939453125, "latence_p95": null, "taux_erreurs": 0.0, "nb_alertes": 0, "gravite_max_alerte": 0, "instant_premiere_anomalie": 10.0}}], "aretes": [{"src": "boutique/frontend", "dst": "boutique/productcatalogservice", "type": "dependance"}, {"src": "boutique/frontend", "dst": "boutique/currencyservice", "type": "dependance"}, {"src": "boutique/frontend", "dst": "boutique/cartservice", "type": "dependance"}, {"src": "boutique/frontend", "dst": "boutique/recommendationservice", "type": "dependance"}, {"src": "boutique/frontend", "dst": "boutique/shippingservice", "type": "dependance"}, {"src": "boutique/frontend", "dst": "boutique/checkoutservice", "type": "dependance"}, {"src": "boutique/frontend", "dst": "boutique/adservice", "type": "dependance"}, {"src": "boutique/checkoutservice", "dst": "boutique/productcatalogservice", "type": "dependance"}, {"src": "boutique/checkoutservice", "dst": "boutique/shippingservice", "type": "dependance"}, {"src": "boutique/checkoutservice", "dst": "boutique/paymentservice", "type": "dependance"}, {"src": "boutique/checkoutservice", "dst": "boutique/emailservice", "type": "dependance"}, {"src": "boutique/checkoutservice", "dst": "boutique/currencyservice", "type": "dependance"}, {"src": "boutique/checkoutservice", "dst": "boutique/cartservice", "type": "dependance"}, {"src": "boutique/recommendationservice", "dst": "boutique/productcatalogservice", "type": "dependance"}, {"src": "boutique/cartservice", "dst": "boutique/redis-cart", "type": "dependance"}], "labels": {"verdict": "attaque", "type": "ddos_syn_flood", "cibles": ["boutique/frontend"], "sources": [], "impactes": []}}